{
  "id": "manager",
  "name": "Manager",
  "role": "support",
  "country": "global",
  "visual": {
    "icon": "📊",
    "color": "#4e78ff",
    "accent": "#f7f7ff",
    "modelType": "box",
    "scale": 1.0,
    "silhouette": "Compact office silhouette, clipboard/tablet always visible, never dressed for frontline combat.",
    "animationPersonality": "Small authoritative gestures, frantic pointing when plans collapse, physically avoids direct fighting."
  },
  "stats": {
    "cost": 220,
    "hp": 150,
    "attack": 18,
    "range": 4.8,
    "attackSpeed": 0.55,
    "moveSpeed": 0.78,
    "deployCD": 8.5
  },
  "combat": {
    "attackType": "ranged",
    "projectileSpeed": 8.5,
    "projectileColor": "#91b6ff",
    "special": "support",
    "normalSkill": "PowerPoint Attack",
    "passive": "Annoyance Meter",
    "hiddenSkill": "Emergency Meeting",
    "counterHooks": ["long_fight", "gym_uncle"]
  },
  "traits": ["support", "non_frontline", "annoying_authority", "paperwork"],
  "relationships": [
    { "target": "gym_uncle", "type": "annoyance", "strength": 0.92 }
  ],
  "comedy": {
    "failureBehavior": "Issues an order at exactly the wrong moment and disrupts a stronger ally.",
    "comedyEvents": ["emergency_meeting", "powerpoint_attack", "manager_cannon"],
    "rareBehaviorChance": 0.045,
    "voice": "Calm corporate certainty even while the battlefield is visibly on fire."
  }
}
